{"$schema":"https://json-schema.org/draft/2020-12/schema","$id":"coco/capability.v1","type":"object","required":["schemaVersion","defaults","denylist","displayNames","capabilityOverrides"],"properties":{"schemaVersion":{"const":1},"defaults":{"type":"object"},"denylist":{"type":"array","items":{"type":"string"}},"displayNames":{"type":"object","additionalProperties":{"type":"string"}},"capabilityOverrides":{"type":"object","additionalProperties":{"type":"object"}},"allowlist":{"type":"object","additionalProperties":{"type":"array","uniqueItems":true,"items":{"type":"string","minLength":1}}}},"additionalProperties":false}
