{"allowlist":{"deepseek":["deepseek-v4-flash","deepseek-v4-pro"]},"capabilityOverrides":{"achai/grok-4.20-0309-reasoning":{"reasoning":true},"achai/grok-4.3":{"reasoning":true},"achai/grok-4.5":{"reasoning":true},"deepseek/deepseek-v4-flash":{"compat":{"requiresReasoningContentOnAssistantMessages":true,"supportsDeveloperRole":false,"supportsStore":false,"thinkingFormat":"deepseek"},"contextWindow":1000000,"cost":{"cacheRead":0.0028,"cacheWrite":0,"input":0.14,"output":0.28},"maxTokens":384000,"reasoning":true,"thinkingLevelMap":{"high":"high","low":null,"max":"max","medium":null,"minimal":null}},"deepseek/deepseek-v4-pro":{"compat":{"requiresReasoningContentOnAssistantMessages":true,"supportsDeveloperRole":false,"supportsStore":false,"thinkingFormat":"deepseek"},"contextWindow":1000000,"cost":{"cacheRead":0.003625,"cacheWrite":0,"input":0.435,"output":0.87},"maxTokens":384000,"reasoning":true,"thinkingLevelMap":{"high":"high","low":null,"max":"max","medium":null,"minimal":null}}},"defaults":{"contextWindow":128000,"cost":{"cacheRead":0,"cacheWrite":0,"input":0,"output":0},"input":["text"],"maxTokens":16384,"reasoning":false},"denylist":["achai/grok-imagine-image","idepub/gpt-image-1","idepub/gpt-image-1.5","idepub/gpt-image-2","idepub/step-image-edit-2","idepub/stepaudio-2.5-asr","idepub/stepaudio-2.5-chat","idepub/stepaudio-2.5-realtime","idepub/stepaudio-2.5-tts"],"displayNames":{"deepseek/deepseek-v4-flash":"DeepSeek V4 Flash","deepseek/deepseek-v4-pro":"DeepSeek V4 Pro","idepub/gpt-5.3-codex-spark":"GPT-5.3 Codex Spark","idepub/gpt-5.6":"GPT-5.6 Sol","idepub/gpt-5.6-luna":"GPT-5.6 Luna","idepub/gpt-5.6-sol":"GPT-5.6 Sol","idepub/gpt-5.6-terra":"GPT-5.6 Terra"},"schemaVersion":1}
